{
  "asset_id": "AID-000006",
  "id_immutable": true,
  "schema_version": "1.0.0",
  "authority_status": "RESEARCH_OPERATIONAL",
  "aliases": [
    "CAND-771-GRAB"
  ],
  "title": "2017 Super Duty Front Door CAD STEP (discovery claim)",
  "source": {
    "platform": "GrabCAD",
    "publisher": null,
    "url": null,
    "url_status": "NOT_RECORDED",
    "marketplace_id": null,
    "access_condition": "Unknown"
  },
  "vehicle": {
    "reported_make": "Ford",
    "reported_model": "Super Duty",
    "reported_year_range": "2017",
    "reported_body": "Front door CAD",
    "listing_claim_summary": "Related-year STEP discovery \u2014 not CONFIGURATION_MATCHED"
  },
  "configuration": {
    "reported_cab": null,
    "reported_ca_in": null,
    "reported_wheelbase_in": null,
    "reported_drivetrain": null,
    "reported_rear_wheels": null,
    "notes": null
  },
  "exact_configuration_match": "COMPARISON_REFERENCE",
  "geometry_types": [
    "STEP"
  ],
  "completeness": {
    "exterior": "NOT_EVALUATED",
    "interior": "NOT_EVALUATED",
    "mechanical": "NOT_EVALUATED",
    "electrical": "NONE",
    "hierarchy_quality": "NOT_EVALUATED",
    "mesh_separation": "NOT_EVALUATED",
    "topology_quality": "NOT_EVALUATED",
    "evaluation_basis": "NOT_EVALUATED"
  },
  "usefulness": {
    "engineering": "NOT_EVALUATED",
    "visual": "NOT_EVALUATED"
  },
  "license": {
    "status": "UNKNOWN",
    "terms_summary": null
  },
  "price": {
    "status": "UNKNOWN",
    "amount_usd": null,
    "currency_note": null
  },
  "lifecycle": {
    "discovered": true,
    "acquired": "NOT_ACQUIRED",
    "parsed": "NOT_EXECUTED",
    "verified": "NOT_EXECUTED"
  },
  "component_coverage": [
    {
      "target": "CMPINST-VEH000001-DOOR-FL",
      "presence": "CLAIMED"
    }
  ],
  "known_deficiencies": [
    "No verified URL or bytes"
  ],
  "evidence_links": [
    {
      "kind": "LANE_A_CATALOG",
      "ref": "layers/L01/L1_LANE_A_ASSET_CATALOG.json#CAND-771-GRAB"
    }
  ],
  "bound_vehicle_instance_id": "VEH-000001",
  "bound_configuration_id": "CFG-000001",
  "configuration_fingerprint": "sha256:dde6a6251b97900dc192587903ce30a236de18f311996231a3f488ef0429d943",
  "related_asset_ids": [
    "AID-000003"
  ],
  "maps_to_src_cand": null,
  "maps_to_candidate_asset_id": "CAND-771-GRAB",
  "edts_role": "CAD_CANDIDATE",
  "research_sprint": "RL-011",
  "decision": "DT-D042",
  "notes": []
}
